{
  "format_version": 1,
  "release": "0.12.0",
  "protocol": "1.10",
  "database_schema": 9,
  "generated_unix_ms": 0,
  "bundle_id": null,
  "source_revision": "REPLACE-WITH-SOURCE-REVISION-BEFORE-USE",
  "provenance": {
    "runner": null,
    "environment": {},
    "inputs": []
  },
  "checks": [],
  "metrics": {}
}
